{
  "$schema": "https://json-schema.org/draft/2020-12/schema",
  "$id": "https://example.invalid/ai-migration-framework/schemas/behavioral-contract.schema.json",
  "title": "Characterized observable behavior",
  "type": "object",
  "required": ["schema_version", "id", "source_units", "preconditions", "stimulus", "observations", "evidence", "known_gaps"],
  "properties": {
    "$schema": {"type": "string"}, "schema_version": {"const": "2.0"}, "id": {"type": "string", "pattern": "^BEH-[0-9]{4,}$"},
    "source_units": {"type": "array", "minItems": 1, "uniqueItems": true, "items": {"type": "string", "pattern": "^SRC-[0-9]{4,}$"}}, "preconditions": {"type": "array", "items": {"type": "string"}}, "stimulus": {"type": "string"}, "observations": {"type": "array", "minItems": 1, "items": {"type": "string"}}, "evidence": {"type": "array", "items": {"type": "string"}}, "known_gaps": {"type": "array", "items": {"type": "string"}}
  },
  "additionalProperties": false
}
