{
  "$schema": "https://example.invalid/ai-migration-framework/schemas/behavioral-contract.schema.json",
  "schema_version": "2.0",
  "id": "BEH-0002",
  "source_units": ["SRC-0002", "SRC-0003", "SRC-0004"],
  "preconditions": ["two orders have equal priority and distinct insertion sequence"],
  "stimulus": "submit both orders concurrently",
  "observations": ["orders are emitted in insertion order", "each order is stored exactly once"],
  "evidence": ["differential test order_equal_priority"],
  "known_gaps": ["legacy diagnostic text is locale-dependent"]
}
