{
  "$schema": "https://example.invalid/ai-migration-framework/schemas/behavioral-contract.schema.json",
  "schema_version": "2.0",
  "id": "BEH-0001",
  "source_units": ["SRC-0001"],
  "preconditions": [],
  "stimulus": "Describe the input or event",
  "observations": ["Describe an externally observable result"],
  "evidence": [],
  "known_gaps": []
}
