{
  "$schema": "https://example.invalid/ai-migration-framework/schemas/behavioral-contract.schema.json",
  "schema_version": "2.0",
  "id": "BEH-0001",
  "source_units": ["SRC-0001", "SRC-0003", "SRC-0004"],
  "preconditions": ["catalog item does not already exist"],
  "stimulus": "POST a valid catalog item",
  "observations": ["item is durably stored", "201 response contains the assigned id", "duplicate retries are idempotent"],
  "evidence": ["source characterization test catalog_create_golden"],
  "known_gaps": []
}
